{"adversary":null,"experiment_card":null,"frontier_calls_used":2,"independence_loss":true,"proposal":{"abort_conditions":["Abort if the fixture manifest hash differs from the specified hash or any requested fixture ID is unavailable.","Abort if either arm resolves to a different model, backend, temperature, top_p, prompt, fixture bytes, or seed.","Abort immediately if any frontier call occurs or GPU usage reaches 10 minutes before all paired measurements complete.","Abort if any arm-fixture measurement or timing record is missing."],"baseline":{"artifact":null,"artifact_sha256":null,"measurement_locator":null,"metric":"critic_decision_accuracy","status":"UNMEASURED","value":null},"candidate":{"single_delta":"On candidate evaluation calls only, select the existing critic_medium profile instead of critic_current; leave the model, prompts, fixtures, seed, and all other settings identical."},"change_surface":["experiments/qwen_critic_effort_ab.json"],"claim":"Using the existing Qwen critic_medium profile for evaluation-only critic calls preserves decision accuracy on the balanced four-fixture critic subset while reducing median wall time by at least 10% versus critic_current.","execution_scope":"EVALUATION_ONLY","experiment":{"arms":["baseline","candidate"],"fixture_ids":["critic_fatal_circular","critic_fatal_dominance","critic_proceed_fixable","critic_proceed_theorem"],"fixture_manifest_path":"bench/weekly_upgrade_eval/fixtures.json","fixture_manifest_sha256":"b6c78b403fae9288497b480778479a7578c3588923daa73309c1ef7dd2d5ce13","guardrails":["Use identical fixture bytes, model, backend, prompt construction, seed, temperature, and top_p in both arms; vary only reasoning_effort through the named profiles.","Record decision validity and end-to-end wall time for every arm-fixture pair before aggregation; count malformed or missing decisions as incorrect.","Do not alter production defaults, runtime configuration, schedulers, schemas, or call sites, and make no frontier calls."],"max_frontier_calls":0,"max_gpu_minutes":10,"max_wall_minutes":20,"pass_rule":"Pass only if candidate critic_decision_accuracy is at least baseline accuracy, every output is evaluator-parseable, and candidate median end-to-end wall time is at least 10% lower than baseline.","primary_metric":"critic_decision_accuracy","seeds":[0]},"external_claims":[],"falsifier":"Falsify the upgrade if candidate accuracy is below baseline, any candidate output is malformed, or candidate median end-to-end wall time is not at least 10% lower under the paired controls.","production_change_authorized":false,"proposal_id":"wu-46f8dbb0","repo_references":[{"locator":"\"critic_current\": _Profile(\n        0.2, 0.95, frozenset({_QWEN_BACKEND}), \"xhigh\"),\n    \"critic_medium\": _Profile(\n        0.2, 0.95, frozenset({_QWEN_BACKEND}), \"medium\"),","path":"agent_wrapper/generation_policy.py","sha256":"3a45aa1303bb0f53fe73533b9750b07049acf3c0a0eaa4107582812f5db449a5"}],"schema_version":"weekly-upgrade-v1","snapshot_sha256":"46f8dbb0dd5fbf51afe35bf4e3ba6f3d4cd3ebdad917d91e52a2e3755c0327f5","tier":"P","title":"Evaluate medium versus xhigh Qwen critic effort","week_id":"2026-W38"},"proposal_sha256":"473be9047299dcf02e75388937d0abdbf69513648b89de3b39c18a315358dce4","reason":"repo reference locator is not in snapshotted text: bench/weekly_upgrade_eval/fixtures.json","reviewed_at":"2026-09-14T04:29:11.113664Z","run_id":"2026-W38-e25e5a193b38","run_manifest_sha256":"f3c497999d2f235df45fa698a251268996e55edff7cbe6f87fc8d91f10611823","schema_version":"weekly-upgrade-report-v1","snapshot_sha256":"46f8dbb0dd5fbf51afe35bf4e3ba6f3d4cd3ebdad917d91e52a2e3755c0327f5","status":"INVALID_REPORT","week_id":"2026-W38"}
